{
  "registry_schema_version": "1.1",
  "repository": "ArazSaieArasi3/CM-PharmE",
  "authority_model": "Semantic Source defines; Wiki explains; Pages exposes generated/exhaustive reference.",
  "lifecycle_states": [
    "evolving",
    "candidate",
    "stable",
    "frozen",
    "historical"
  ],
  "path_policy": {
    "root": "ontology/",
    "mutable_alias_kind": "current",
    "stable_version_paths_immutable": true,
    "historical_overwrite_prohibited": true,
    "release_bound_requires_exact_source_ref": true
  },
  "versions": [
    {
      "id": "v1",
      "version_family": "CM-PharmE 1.x",
      "reader_label": "CM-PharmE 1.0",
      "lifecycle_state": "stable",
      "semantic_release": "v1.0.0",
      "semantic_source_ref": "main@595ea30a66644c1b130b6c1a781dc7afbd7ba284",
      "semantic_source_paths": [
        "ontology/source/modules/"
      ],
      "assembly_rule": "Use the governed V1 ontology build/assembly pipeline from canonical source modules; generated distributions are derived artifacts, not authoring authority.",
      "documentation_input": {
        "kind": "deterministic_assembled_ontology",
        "source_family": "ontology/source/modules/",
        "build_contract_issue": 269,
        "resolved_artifact": "generated:distributions/cm-pharme.ttl",
        "fingerprint": "cc823a8aff4d7e7818f8470f2dbad6ca8045ff92e5637fbf3503bc105170a83f"
      },
      "generated_reference_enabled": true,
      "webvowl_enabled": true,
      "immutable_version_path": "ontology/v1.0.0/",
      "current_path": null,
      "documentation_baseline_binding": null,
      "citation_status": "version_bound_pages_reference_verified",
      "supersedes": null,
      "superseded_by": "v2",
      "public_status_label": "Stable V1 semantic baseline; version-bound generated Pages reference publicly verified at R1.",
      "wiki_explanation_path": "V1-Formal-Ontology"
    },
    {
      "id": "v2",
      "version_family": "CM-PharmE 2.x",
      "reader_label": "CM-PharmE 2.0",
      "lifecycle_state": "evolving",
      "semantic_release": null,
      "semantic_source_ref": "v2/research-program@1226b0a5484f8f5d3a8d214e0d0f52f066b88999",
      "semantic_source_paths": [
        "v2/ontology/source/modules/00-metadata.ttl",
        "v2/ontology/source/modules/10-core.ttl",
        "v2/ontology/source/modules/20-xinfra.ttl",
        "v2/ontology/source/modules/25-gate-d-disjointness.ttl",
        "v2/ontology/source/modules/30-extensions.ttl",
        "v2/ontology/source/modules/40-mappings.ttl"
      ],
      "assembly_rule": "Use the governed V2 formal build from the registered module set at the exact source ref. Do not infer a frozen V2.0.0 release from documentation publication.",
      "documentation_input": {
        "kind": "deterministic_assembled_ontology",
        "source_family": "v2/ontology/source/modules/",
        "build_contract_issue": 269,
        "resolved_artifact": "generated:distributions/cm-pharme-v2.ttl",
        "fingerprint": "302a5f70db30701608712a2c346f6a5b4bbc72b4cb9c7a921ed6e38bbebd341f"
      },
      "generated_reference_enabled": true,
      "webvowl_enabled": true,
      "immutable_version_path": null,
      "current_path": "ontology/v2/current/",
      "documentation_baseline_binding": "docs/documentation/v2-current-pages-baseline.json",
      "citation_status": "evolving_not_release_bound",
      "supersedes": "v1",
      "superseded_by": null,
      "public_status_label": "Stable-to-date / Evolving; current Pages snapshot includes governed naming annotations and is not a frozen semantic release.",
      "wiki_explanation_path": "V2-Formal-Ontology-and-SHACL"
    },
    {
      "id": "v2-m1",
      "asset_kind": "released_profile",
      "profile": {
        "base_version_id": "v2",
        "profile_version": "0.1.0",
        "distribution_version": "2.1.0",
        "domain_namespace": "https://w3id.org/cm-pharme/2.1/",
        "release_url": "https://github.com/ArazSaieArasi3/CM-PharmE/releases/tag/2.1.0",
        "citation_url": "https://github.com/ArazSaieArasi3/CM-PharmE/blob/77a8e854d0e3927b0687346d7f8fda6a398adda7/CITATION.cff",
        "canonical_ttl_url": "https://github.com/ArazSaieArasi3/CM-PharmE/blob/77a8e854d0e3927b0687346d7f8fda6a398adda7/source/v2/ontology/profiles/2.1/m1-provenance/0.1.0/profile.ttl",
        "support_manifest_url": "https://github.com/ArazSaieArasi3/CM-PharmE/blob/77a8e854d0e3927b0687346d7f8fda6a398adda7/source/v2/release/2.1/support/0.1.0/manifest.json",
        "archive_sha256": "4c9d3a1e52379c8c63b3619aedd7d0243cf702bcc078c9989a23619d50cc4350",
        "scope_summary": "Released M1 provenance profile: four CM-PharmE classes and two CM-PharmE object properties; local admission and seven synthetic M001\u2013M004 records. Full V2 remains evolving."
      },
      "version_family": "CM-PharmE 2.x \u2014 released profile",
      "reader_label": "CM-PharmE 2.1.0 \u2014 M1 Provenance Core",
      "lifecycle_state": "stable",
      "semantic_release": "2.1.0",
      "semantic_source_ref": "release/2.1.0@77a8e854d0e3927b0687346d7f8fda6a398adda7",
      "semantic_source_paths": [
        "source/v2/ontology/profiles/2.1/m1-provenance/0.1.0/profile.ttl"
      ],
      "assembly_rule": "Consume the exact byte-pinned released M1 TBox through the common documentation-input pipeline; retain its 0.1.0 profile and 2.1.0 distribution identities.",
      "documentation_input": {
        "kind": "deterministic_assembled_ontology",
        "source_family": "source/v2/ontology/profiles/2.1/m1-provenance/0.1.0/",
        "build_contract_issue": 269,
        "resolved_artifact": "generated:distributions/cm-pharme-m1.ttl",
        "fingerprint": "7b7cff97eedc071a6c1f15d71f58eadb2a9a1d3bcdfc7f38b14a920b70707186"
      },
      "generated_reference_enabled": true,
      "webvowl_enabled": true,
      "immutable_version_path": "ontology/2.1.0/m1/",
      "current_path": null,
      "documentation_baseline_binding": "docs/documentation/m1-profile-release.json",
      "citation_status": "release_specific_2.1.0_citation_bound; public documentation candidate not yet deployed",
      "supersedes": null,
      "superseded_by": null,
      "wiki_explanation_path": "M1-Provenance-Core-2.1.0",
      "public_status_label": "Stable released M1 profile; full V2 remains evolving"
    }
  ],
  "future_version_contract": {
    "minimum_id_pattern": "vN",
    "onboarding_mechanism": "add_registry_entry_then_common_pipeline",
    "copied_workflow_allowed": false,
    "fictional_or_unreleased_scientific_content_must_not_be_published": true,
    "required_fields": [
      "id",
      "version_family",
      "reader_label",
      "lifecycle_state",
      "semantic_source_ref",
      "semantic_source_paths",
      "assembly_rule",
      "documentation_input",
      "generated_reference_enabled",
      "webvowl_enabled",
      "immutable_version_path",
      "current_path",
      "documentation_baseline_binding",
      "citation_status",
      "supersedes",
      "superseded_by",
      "wiki_explanation_path",
      "public_status_label"
    ],
    "profile_id_pattern": "vN-profile"
  }
}
